<?xml version="1.0" encoding="UTF-8" standalone="yes"?>
<toys xmlns:xsi="http://www.w3.org/2001/XMLSchema-instance"
         xmlns:ns="http://www.third/kastsiuchenka.by/toys"
         xsi:schemaLocation="http://www.third/kastsiuchenka.by/toys toy.xsd">

    <music-toy toy-id="t1" toy-type="MUSIC_TOY" is-interactive="true">
        <model>FunnyPiano</model>
        <brand-name>CHUI</brand-name>
        <material>PLASTIC</material>
        <cost>120.00</cost>
        <external-parameters>
            <weigth>2000</weigth>
            <length>60</length>
            <width>30</width>
            <heigth>10</heigth>
        </external-parameters>
        <type-music-toy>PIANO</type-music-toy>
        <number-tones>40</number-tones>
        <main-colour>RED</main-colour>
    </music-toy>
    <music-toy toy-id="t2" toy-type="MUSIC_TOY" is-interactive="true">
        <model>dudka</model>
        <brand-name>polesie</brand-name>
        <material>PLASTIC</material>
        <cost>7.50</cost>
        <external-parameters>
            <weigth>300</weigth>
            <length>20</length>
            <width>30</width>
            <heigth>20</heigth>
        </external-parameters>
        <type-music-toy>PIPE</type-music-toy>
        <number-tones>12</number-tones>
        <main-colour>YELLOW</main-colour>
    </music-toy>
    <transport-toy toy-id="t3" number-weels="4" scale="1:15"  toy-type="TRANSPORT_TOY">
        <model>molniya</model>
        <brand-name>polesie</brand-name>
        <material>PLASTIC</material>
        <cost>12.00</cost>
        <external-parameters>
            <weigth>250</weigth>
            <length>15</length>
            <width>15</width>
            <heigth>15</heigth>
        </external-parameters>
        <type-transport-toy>SPORTCAR</type-transport-toy>
        <type-control>MANUAL</type-control>
        <body-colour>RED</body-colour>
    </transport-toy>
    <music-toy toy-id="t4" toy-type="MUSIC_TOY" is-interactive="true">
        <model>baraban</model>
        <brand-name>mali</brand-name>
        <material>PLASTIC</material>
        <cost>7.50</cost>
        <external-parameters>
            <weigth>300</weigth>
            <length>20</length>
            <width>30</width>
            <heigth>20</heigth>
        </external-parameters>
        <type-music-toy>Drum</type-music-toy>
        <number-tones>12</number-tones>
        <main-colour>YELLOW</main-colour>
    </music-toy>
    <music-toy toy-id="t5" toy-type="MUSIC_TOY" is-interactive="true">
        <model>1234</model>
        <brand-name>malan</brand-name>
        <material>PLASTIC</material>
        <cost>100</cost>
        <external-parameters>
            <weigth>300</weigth>
            <length>20</length>
            <width>30</width>
            <heigth>20</heigth>
        </external-parameters>
        <type-music-toy>XYLOPHONE</type-music-toy>
        <number-tones>12</number-tones>
        <main-colour>YELLOW</main-colour>
    </music-toy>
    <transport-toy toy-id="t6" number-weels="4" scale="1:15"  toy-type="TRANSPORT_TOY">
        <model>pulya</model>
        <brand-name>polesie</brand-name>
        <material>PLASTIC</material>
        <cost>12.00</cost>
        <external-parameters>
            <weigth>250</weigth>
            <length>15</length>
            <width>15</width>
            <heigth>15</heigth>
        </external-parameters>
        <type-transport-toy>SPORTCAR</type-transport-toy>
        <type-control>MANUAL</type-control>
        <body-colour>RED</body-colour>
    </transport-toy>
    <transport-toy toy-id="t7" number-weels="4" scale="1:5"  toy-type="TRANSPORT_TOY">
        <model>shmulya</model>
        <brand-name>polesie</brand-name>
        <material>PLASTIC</material>
        <cost>12.00</cost>
        <external-parameters>
            <weigth>250</weigth>
            <length>15</length>
            <width>40</width>
            <heigth>15</heigth>
        </external-parameters>
        <type-transport-toy>TRUCK</type-transport-toy>
        <type-control>RADIO</type-control>
        <body-colour>RED</body-colour>
    </transport-toy>
    <transport-toy toy-id="t8" number-weels="4" scale="1:16"  toy-type="TRANSPORT_TOY">
        <model>molniya</model>
        <brand-name>polesie</brand-name>
        <material>PLASTIC</material>
        <cost>12.00</cost>
        <external-parameters>
            <weigth>250</weigth>
            <length>15</length>
            <width>15</width>
            <heigth>15</heigth>
        </external-parameters>
        <type-transport-toy>TRUCK</type-transport-toy>
        <type-control>MANUAL</type-control>
        <body-colour>RED</body-colour>
    </transport-toy>
    <transport-toy toy-id="t9" number-weels="4" scale="1:10"  toy-type="TRANSPORT_TOY">
        <model>pogruzchk</model>
        <brand-name>polesie</brand-name>
        <material>PLASTIC</material>
        <cost>12.00</cost>
        <external-parameters>
            <weigth>400</weigth>
            <length>15</length>
            <width>15</width>
            <heigth>15</heigth>
        </external-parameters>
        <type-transport-toy>TRUCK</type-transport-toy>
        <type-control>MANUAL</type-control>
        <body-colour>RED</body-colour>
    </transport-toy>
    <music-toy toy-id="t10" toy-type="MUSIC_TOY" is-interactive="false">
        <model>tramboline</model>
        <brand-name>polesie</brand-name>
        <material>PLASTIC</material>
        <cost>20.00</cost>
        <external-parameters>
            <weigth>500</weigth>
            <length>20</length>
            <width>30</width>
            <heigth>20</heigth>
        </external-parameters>
        <type-music-toy>TAMBOURINE</type-music-toy>
        <number-tones>12</number-tones>
        <main-colour>BLUE</main-colour>
    </music-toy>
    <music-toy toy-id="t11" toy-type="MUSIC_TOY" is-interactive="false">
        <model>gitara</model>
        <brand-name>belvar</brand-name>
        <material>PLASTIC</material>
        <cost>17.50</cost>
        <external-parameters>
            <weigth>500</weigth>
            <length>20</length>
            <width>30</width>
            <heigth>20</heigth>
        </external-parameters>
        <type-music-toy>GUITAR</type-music-toy>
        <number-tones>12</number-tones>
        <main-colour>ORANGE</main-colour>
    </music-toy>
    <transport-toy toy-id="t12" number-weels="4" scale="1:11"  toy-type="TRANSPORT_TOY">
        <model>mumu</model>
        <brand-name>polesie</brand-name>
        <material>PLASTIC</material>
        <cost>12.00</cost>
        <external-parameters>
            <weigth>400</weigth>
            <length>15</length>
            <width>15</width>
            <heigth>15</heigth>
        </external-parameters>
        <type-transport-toy>EXCAVATOR</type-transport-toy>
        <type-control>MANUAL</type-control>
        <body-colour>RED</body-colour>
    </transport-toy>
    <transport-toy toy-id="t13" number-weels="4" scale="1:10"  toy-type="TRANSPORT_TOY">
        <model>pogruzchk2</model>
        <brand-name>polesie</brand-name>
        <material>PLASTIC</material>
        <cost>12.00</cost>
        <external-parameters>
            <weigth>400</weigth>
            <length>15</length>
            <width>15</width>
            <heigth>45</heigth>
        </external-parameters>
        <type-transport-toy>TRUCK</type-transport-toy>
        <type-control>MANUAL</type-control>
        <body-colour>WHITE</body-colour>
    </transport-toy>
    <transport-toy toy-id="t14" number-weels="4" scale="1:12"  toy-type="TRANSPORT_TOY">
        <model>gruzovik</model>
        <brand-name>belvar</brand-name>
        <material>STEEL</material>
        <cost>12.00</cost>
        <external-parameters>
            <weigth>500</weigth>
            <length>25</length>
            <width>15</width>
            <heigth>15</heigth>
        </external-parameters>
        <type-transport-toy>TRUCK</type-transport-toy>
        <type-control>MANUAL</type-control>
        <body-colour>RED</body-colour>
    </transport-toy>
    <transport-toy toy-id="t15" number-weels="4" scale="1:11"  toy-type="TRANSPORT_TOY">
        <model>pogruzchk</model>
        <brand-name>belaz</brand-name>
        <material>STEEL</material>
        <cost>12.00</cost>
        <external-parameters>
            <weigth>400</weigth>
            <length>34</length>
            <width>23</width>
            <heigth>20</heigth>
        </external-parameters>
        <type-transport-toy>EXCAVATOR</type-transport-toy>
        <type-control>MANUAL</type-control>
        <body-colour>BLACK</body-colour>
    </transport-toy>
    <music-toy toy-id="t16" toy-type="MUSIC_TOY" is-interactive="false">
        <model>funfun</model>
        <brand-name>belvar</brand-name>
        <material>PLASTIC</material>
        <cost>30.50</cost>
        <external-parameters>
            <weigth>500</weigth>
            <length>20</length>
            <width>30</width>
            <heigth>20</heigth>
        </external-parameters>
        <type-music-toy>XYLOPHONE</type-music-toy>
        <number-tones>12</number-tones>
        <main-colour>ORANGE</main-colour>
    </music-toy>
</toys>